"Id","FirstName","LastName","Title","ShortDescription","Presentation","ServiceIds"
"e717ea06-c4a0-473f-93a7-3722c22022f8","Sonja","Eräranta","Psykologi, psykoterapeutti","Asiantunteva psykoterapian ja psykologian ammattilainen","Olen psykoterapeutti, pari- ja perheterapeutti, psykologi ja työnohjaaja. Erityisosaamistani ovat työterveyden lyhytpsykoterapia, mielen hyvinvointi, perhesuhteiden huolenaiheet ja elämän muutostilanteet. Työskentelen työikäisten, lasten ja perheiden sekä parisuhteiden hyvinvoinnin tukena. Vastaanotolleni voit tulla niin omille käynneille kuin yhdessä läheistesi kanssa. Lämpimästi tervetuloa!

Psykoterapeuttina ja psykologina olen asiakasta arvostava, voimavarakeskeinen, avoin ja läsnä oleva.
Työskentelyäni ohjaa dialoginen ja tunnekeskeinen viitekehys, ja menetelmät pohjautuvat tutkittuun tietoon. Työskentelen joustavasti ja asiakaslähtöisesti. Terapeuttisen keskustelun lisäksi hyödynnän kehollisuutta ja kokemuksellisuutta. 

Valitettavasti en voi aloittaa pitkiä Kelan tukemia kuntoutuspsykoterapioita. Oikeuteen tarkoitettujen lausuntojen osalta käännythän toisen asiantuntijan puoleen. Työnohjaajana työskentelen yksilöiden ja ryhmien kanssa työhyvinvoinnin teemoissa.","Surevan tuki, Elintapamuutosten psykologinen tuki, Stressin säätelytaitojen vahvistaminen, Pariterapia, Psykologi, Sopeutumishäiriöiden tutkimus ja hoito, Psykoterapia, psykoterapeutti, Vakavaan sairauteen sopeutuminen, Työnohjauspalvelut, Lastenpsykologin vastaanotto, Eroauttaminen, Perheen tuki, Nuoren psykologinen tuki, Unettomuus, Työuupumuksen tutkimus ja hoito, Lapsiperheen mielen tuki, Työterveyden lyhytpsykoterapia, Parisuhteen tuki, Mielenterveyden tuki ja hoito, Lapsen psykologinen tuki, Ahdistuneisuushäiriöiden tutkimus ja hoito , Seksuaalisuuden kysymykset, Vihan käsittely, Kriisituki, Väsymys ja sen hoito, Perheterapia, Lasten univaikeuksien hoito"
"c889f4f1-1c40-46f8-b67a-75e66c117902","Pia","Laakkonen","psykologi, psykoterapeutti","","Olen koulutukseltani psykologi ja psykoterapeutti. Olen erikoistunut lastenpsykoterapiaan ja psykodiagnostiikkaan sekä perheiden kanssa työskentelyyn. Vankan ja monipuolisen työkokemukseni ansiosta pystyn tarkastelemaan lapsen ja perheen kuin vanhempienkin tilannetta kokonaisvaltaisesti. Kaiken muutoksen lähtökohtana on turvallisen, hyväksyvän ja myönteisen vuorovaikutussuhteen rakentaminen ja työskentelyn tavoitteiden räätälöinti kunkin tarpeiden mukaisesti. Ulkomailla asuttujen vuosien aikana olen tottunut työskentelemään eri kulttuuritaustoista olevien ihmisten kanssa. Olen työskennellyt perusterveydenhuollossa, erikoissairaanhoidossa sekä työnohjaajaajana. Teen eripituisia psykoterapioita. Tervetuloa!","Kouluvalmiustutkimus, Paniikkihäiriön tutkimus ja hoito , Maahanmuuttajan ja turvapaikanhakijan tuki, Psykologi, Masennuksen tutkimus ja hoito , Psykoterapia, psykoterapeutti, Psykodynaaminen ja psykoanalyyttinen psykoterapia, 7d5f554b-9117-457e-819b-53a28bbdd453, Vanhempien ohjauskäynnit (osana lapsen tai nuoren psykoterapiaa) , afa8545f-02d2-4d39-9e1f-62fedbdb9724, Työnohjauspalvelut, Lastenpsykologin vastaanotto, Kognitiiviset menetelmät, Lasten psykoterapia, b2b31ce3-061f-47d9-9fd8-80a62b89b498, Työterveyden lyhytpsykoterapia, 88f839d1-9603-4011-921e-be3cde638034, Ahdistuneisuushäiriöiden tutkimus ja hoito , Psykologinen tutkimus, Kriisituki"
"126b135e-2185-474e-befe-8645130404e7","Ilkka","Tuomi","Työterveyspsykologi","Työterveyspsykologi","Olen taustakoulutukseltani psykologi ja psykoterapeutti. Työterveyspsykologina työskentelen laajasti yksilöasiakkaiden, työyhteisöjen, esihenkilöiden, johdon ja organisaatioiden tukena. Yksilökäynneillä autan asiakkaitani jäsentämään työ- ja kokonaiselämäntilannettaan, niihin liittyviä haasteita ja tunnistamaan voimavaratekijöitä. Etsimme yhdessä sopivia keinoja ongelmien helpottamiseksi ja tasapainoisen tilanteen löytämiseksi. 

Minulla on lisäksi kokemusta kognitiivisten kartoitusten tekemisestä. Organisaatiotasolla teen työtä muun muassa työhyvinvoinnin, työyhteisöjen toimivuuden, kognitiivisen ergonomian, esihenkilötyön ja johtamisen tukemiseksi sekä olen apuna muutos-, ristiriita ja kriisitilanteissa. Työskentelyotteeni on aktiivinen ja asiakaslähtöinen.  Teen myös työterveyden lyhytpsykoterapioita.","Mindfulness, Ristiriitatilanteet, Psykososiaaliset kriisitilanteet työpaikalla, Muutostuki, Työnohjauspalvelut, Työuupumuksen tutkimus ja hoito, Työterveyden lyhytpsykoterapia, Työnohjauspalvelut työterveysasiakkaalle, Terveys- ja hyvinvointiluennot, TyöOptimi, Savuttomuus (yksilötuki), c4a4766f-34f7-44fc-8daa-78d8ce538984, Tietoisuustaidot eli Mindfulness, Työterveyspsykologi, Esimiestyön sparraus, Tietotyön kehittäminen, Palautuminen, Hyväksymis- ja omistautumisterapia (HOT), Unettomuuden hoito (yksilötuki), Painonhallinta ja elämäntapamuutos (yksilötuki), Varhainen tuki ja haastavat tilanteet"
"83d40160-ce77-4e2f-9866-c38d2cb2c786","Hannu","Piispanen ","Psykoterapeutti, seksuaaliterapeutti, työnohjaaja","Ammattitaitoinen psykoterapeutti, seksuaaliterapeutti ja työnohjaaja","Olen psykoterapeutti ja perheterapeutti (ET) ja paripsykoterapeutti, seksuaaliterapeutti ja työnohjaaja (STOry). Olen tällä hetkellä myös EMDR-terapeutin täydennyskoulutuksessa.

Palvelen itsemaksavia, työterveyshuollon sekä vakuutuksenkin kautta tulevia asiakkaita yksilö-, pari- ja perhe- sekä seksuaaliterapeuttisissa kysymyksissä. Toteutan myös lyhytterapeuttista työskentelyä (1-20 käyntiä). 

On tärkeää etsiä voimavaroja ja onnistumisten kautta parantaa elämänlaatua sekä elämänhallintaa jaksamisen, ahdistuneisuuden, vuorovaikutuksen ja kuormittavien elämäntilanteiden haasteisiin. Olen myös perehtynyt parisuhteen ja erilaisten kriisien haasteisiin. Miesten seksuaalisuuteen liittyvät kysymykset kuuluvat myös palveluvalikkooni, kuten myös lähisuhdeväkivaltatyön kysymykset. Työtapoihin kuuluvat keskustelu, tehtävät ja harjoitukset. Olen mielelläni mukana auttamassa sinua.","Surevan tuki, Seksuaaliterapia, Stressin säätelytaitojen vahvistaminen, Pariterapia, Maahanmuuttajan ja turvapaikanhakijan tuki, 5c293540-ef20-437d-945f-3321804b8a08, Päihdeongelmien lyhytpsykoterapia työterveysasiakkaille, afa8545f-02d2-4d39-9e1f-62fedbdb9724, Työnohjauspalvelut, 15a284a3-75f0-4030-95da-672c8b50cbed, Eroauttaminen, Soittopyyntö, Ikääntyvän psykologinen tuki, Puhelinvastaanotto, Työuupumuksen tutkimus ja hoito, Työterveyden lyhytpsykoterapia, Itsetuhoisuuden tutkimus ja hoito, Seksuaalisuuden kysymykset, Kriisituki"
"2003fb4e-7663-4c3c-aba1-c302338b6c18","Saara","Salo","Psykologi, psykoterapeutti","Tukea elämän tärkeisiin ihmissuhteisiin.","Olen psykologi ja psykoterapeutti, erikoistunut lasten, perheiden ja parien kanssa työskentelyyn. Erityisosaamistani on työskennellä ihmissuhdekysymysten kanssa, miten oppia toimimaan ja ymmärtämään omia kiintymyssuhteita kumppaneihin, lapseen, alkaneeseen raskauteen ja koko perheeseen. Työskentelen lyhytterapeuttisesti, vuorovaikutteisesti ja aktiivisesti; keskityn tukemaan kykyä pysähtyä ja alkaa pohtia tietoisesti, mitä ihmisten välillä tapahtuu omissa ajatuksissa ja tunteiden tasolla ja miten ylläpitää toimivia ihmissuhteita. Teen myös pidempiä terapiaprosesseja rajallisesti (varhaisen vuorovaikutuksen psykoterapia, mentalisaatiopohjainen perheterapia). Koulutan ja työnohjaan omalta alaltani varhaisen vuorovaikutuksen, aikuisiän kiintymyssuhteiden sekä mentalisaatiokyvyn näkökulmista.","Pariterapia, Psykologi, Psykoterapia, psykoterapeutti, afa8545f-02d2-4d39-9e1f-62fedbdb9724, Lastenpsykologin vastaanotto, Lapsen ja vanhemman välisen vuorovaikutuksen tuki , Lapsiperheen mielen tuki, Työterveyden lyhytpsykoterapia, Lapsen psykologinen tuki, 88f839d1-9603-4011-921e-be3cde638034, Tunnekeskeinen paripsykoterapia (EFT)"
"48c5e365-465a-4a6d-944f-46947df1198b","Pirjo","Kotkamo","Psykoterapeutti","Kokonaisvaltaista tukea elämän kriiseissä","Olen koulutukseltani psykiatrinen erikoissairaanhoitaja ja psykoterapeutti. Minulla on pitkä kokemus elämän kriiseissä tukemisesta (keskenmeno, lapsettomuus, seksuaalinen monimuotoisuus, ero, vanhemmuus, saattohoito, menetykset, krooniset sairaudet, rikosseuraamus), masennuksen, ahdistuneisuuden ja työuupumuksen hoidosta sekä mies- ja isätyöstä. Isien masennuksen hoito sekä mieltä painavien uskonnollisten kysymysten pohtiminen ovat erityisen mielenkiintoni kohteita. 

Työskentelen kokonaisvaltaisesti ja tavoitteellisesti huomioiden elämäntilanteen, verkostot ja elämänhistorian. 

Voit tulla vastaanotolle kumppanisi tai perheesi kanssa. Työtäni ohjaa tutkittu tieto, arvostava kohtaaminen, toivo, luottamuksellisuus sekä kannustava ote.
Tervetuloa vastaanotolleni!","Surevan tuki, Elintapamuutosten psykologinen tuki, Stressin säätelytaitojen vahvistaminen, Paniikkihäiriön tutkimus ja hoito , Masennuksen tutkimus ja hoito , Sopeutumishäiriöiden tutkimus ja hoito, Väsymys, Psykoterapia, psykoterapeutti, Päihdeongelmien lyhytpsykoterapia työterveysasiakkaille, Vakavaan sairauteen sopeutuminen, Kivun psykologinen hoito, Työnohjauspalvelut, Eroauttaminen, Kognitiiviset menetelmät, Perheen tuki, Soittopyyntö, Kaksisuuntaisen mielialahäiriön tutkimus ja hoito, Ikääntyvän psykologinen tuki, Työuupumuksen tutkimus ja hoito, Mielen hyvinvoinnin asiantuntijaluennot, Syömishäiriöiden tutkimus ja hoito, Työterveyden lyhytpsykoterapia, Mielenterveyden tuki ja hoito, Seksuaalisuuden ja sukupuolen moninaisuus, Itsetuhoisuuden tutkimus ja hoito, Ahdistuneisuushäiriöiden tutkimus ja hoito , Seksuaalisuuden kysymykset, Psykoosien ja skitsofrenian tutkimus ja hoito, Pakko-oireiden tutkimus ja hoito, Kriisituki, Epävakaan persoonallisuushäiriön tutkimus ja hoito "
"7f03226e-9f55-467b-bbf6-1be0f977be5e","Risto","Havunen","Psykoterapeutti, Sosiaalipsykologi, eMBA","Olen psykoterapeuttina erikoistunut haastavien tilanteiden ratkaisuun organisaatio-, työyhteisö- ja yksilötasoilla.","Ihmisten johtaja on usein puun ja kuoren välissä. Jatkuva tunne asioiden keskeneräisyydestä sekä tasapainoilu liiketoiminnan tavoitteiden, alaisten tarpeiden ja oman elämäntilanteen välillä on kuormittavaa. Mitä enemmän vastuuta, sitä yksinäisempi työrooli ja samalla vähemmän tilaisuuksia pohtia ratkaisuja jaksamisen näkökulmasta. Johtajan työhön ja psyykkeeseen liittyvät usein yksinäisyyden, riittämättömyyden, keskeneräisyyden ja ristipaineen tunteet. Pahimmillaan jatkuva stressitila johtaa ylikierroksiin, uniongelmiin, muistin ja muiden kognitiivisten toimintojen häiriöihin.

Työotteeni perustuu voimavara- ja ratkaisukeskeiseen psykoterapiaan sekä kognitiivisen käyttäytymisterapian menetelmiin. Nämä ovat erityisen toimiva työkaluja, kun mieltä vaivaavat vaikeat uudistumiseen ja muutokseen liittyvät haasteet tai jaksamisongelmat.","Elintapamuutosten psykologinen tuki, Stressin säätelytaitojen vahvistaminen, Paniikkihäiriön tutkimus ja hoito , Masennuksen tutkimus ja hoito , Psykoterapia, psykoterapeutti, Työnohjauspalvelut, Työuupumuksen tutkimus ja hoito, Työterveyden lyhytpsykoterapia, Esimiestyön sparraus, Mielenterveyden tuki ja hoito, Ratkaisu- ja voimavarakeskeinen psykoterapia , Ahdistuneisuushäiriöiden tutkimus ja hoito , Sopeutumishäiriöiden tutkimus ja hoito, Mielen hyvinvoinnin asiantuntijaluennot, Hyväksymis- ja omistautumisterapia (HOT)"
"fe385161-d54f-4639-8831-0a86bdfaccbb","Tiina","Tammivuori","Psykoterapeutti, psykologi","Ammattitaitoinen psykologi ja psykoterapeutti","Olen pohjakoulutukseltani psykologi ja psykoterapiakoulutukseltani nuorten aikuisten ja aikuisten ratkaisukeskeinen psykoterapeutti sekä EMDR-terapeutti. Psykoterapiatyössäni olen perehtynyt erityisesti ahdistuneisuus- ja masentuneisuusproblematiikkaan, stressi- ja uupumusoireisiin sekä vaikeiden elämäntapahtumien työstämiseen. Tapaamisilla pidän tärkeänä asiakkaan kokemusta kuulluksi ja ymmärretyksi tulemisesta. Työotteeltani olen tilaa antava ja aktiivinen. Olen lasten ja nuorten erikoispsykologi ja kokenut lasten, nuorten ja perheiden kanssa työskentelyssä. Lisäksi olen lasten ja nuorten EMDR-terapeutti. Vastaanotollani käsiteltäviä aiheita ovat usein esimerkiksi vaikeat elämänkokemukset, haasteet vanhemmuudessa/perhe-elämässä tai huoli lapsen kehityksestä, tunne-elämästä, mielialasta, käyttäytymisestä, kaverisuhteista tai oppimisesta.","Kouluvalmiustutkimus, Surevan tuki, Elintapamuutosten psykologinen tuki, Lapsen tai nuoren psykologinen arviointi, Stressin säätelytaitojen vahvistaminen, Psykologi, Nuorten psykoterapia, Masennuksen tutkimus ja hoito , Psykoterapia, psykoterapeutti, Vanhempien ohjauskäynnit (osana lapsen tai nuoren psykoterapiaa) , Vakavaan sairauteen sopeutuminen, Lastenpsykologin vastaanotto, ADHD:n arviointi ja tuki, Eroauttaminen, Kognitiiviset menetelmät, Nuoren psykologinen tuki, EMDR, Ikääntyvän psykologinen tuki, Lapsen ja vanhemman välisen vuorovaikutuksen tuki , Lapsiperheen mielen tuki, Työterveyden lyhytpsykoterapia, Mielenterveyden tuki ja hoito, Seksuaalisuuden ja sukupuolen moninaisuus, Lapsen psykologinen tuki, Fobioiden tutkimus ja hoito , Ratkaisu- ja voimavarakeskeinen psykoterapia , Ahdistuneisuushäiriöiden tutkimus ja hoito , Seksuaalisuuden kysymykset, Hypnoterapia, Vihan käsittely, Psykologinen tutkimus, Kriisituki, Väsymys ja sen hoito, Sopeutumishäiriöiden tutkimus ja hoito, Väsymys, Perheen tuki, Työuupumuksen tutkimus ja hoito"
"620d49db-2e45-4824-979e-9f320c45c7f0","Pauli","Pääkkönen","Psykoterapeutti, seksuaaliterapeutti","Psykoterapeutti, seksuaaliterapeutti (NACSAC), työnohjaaja ja työfysioterapeutti","Olen vaativan erityistason ratkaisukeskeinen psykoterapeutti ja seksuaaliterapeutti (NACS-auktorisoitu). Persoonallisen ja ”maanläheisen” lähestymistapani kautta voimme tutkia useita elämään ja työelämään liittyviä ilmiöitä. Minulla on myös fysioterapeuttitausta ja sitä hyödyntäen pääsen käsittelemään sekä fyysiseen että psyykkiseen työssä jaksamiseen liittyviä asioita, kuten stressiä ja työuupumista. Työhistoriaani kuuluu lähes 30 vuoden kokemus fysioterapia/kuntoutustyöskentelystä sekä työnohjaus- ja terapiaosaaminen lähes 15 vuoden ajalta. Seksuaaliterapiassa voin tutkia seksuaalisuuteen ja sukupuolisuuteen liittyviä kysymyksiä. Terapian avulla voidaan edistää seksuaalista hyvinvointia sekä hoitaa erilaisia seksuaalisia ongelmia. Seksuaaliterapiasta voi saada apua esimerkiksi erilaisiin epävarmuuden, hämmennyksen tai syyllisyyden tunteisiin, fyysisiin toimintahäiriöihin tai riippuvuus- ja luottamusongelmiin.","Terveys- ja hyvinvointiluennot, Seksuaaliterapia, Kuntotestit, Työfysioterapeutti, Psykoterapia, psykoterapeutti, b6393f33-6634-4119-95fe-5dc2d8149706, 175d606a-f964-4eb3-aea4-6367012fd460, Työnohjauspalvelut, Kelan kuntoutuspsykoterapia, Mielen hyvinvoinnin asiantuntijaluennot, Kävelytesti, Työterveyden lyhytpsykoterapia, Palautuminen, 88f839d1-9603-4011-921e-be3cde638034, Ratkaisu- ja voimavarakeskeinen psykoterapia , Interpersonaalinen psykoterapia (IPT), Niskaryhmä ja selkäryhmä"
"7fd04594-5db8-4bad-bcfc-207871ce4378","Mirva","Feller","Yleislääkäri","Pätevä yleislääkäri","Olen lääkäri sekä ratkaisukeskeinen psykoterapeutti. 
Psykoterapiaan voit tulla joko työterveyslääkärin lähetteellä, Kelan tukemaan kuntoutuspsykoterapiaan tai itse maksaen. Psykoterapeuttina olen turvallinen sekä aktiivinen muutoksen mahdollistaja. Psykoterapiassa työskentelemme yhdessä kohti Sinulle merkityksellistä tavoitetta. Esimerkiksi masennus, ahdistus, kriisit ja traumat ovat hyviä syitä hakeutua psykoterapiaan. 60 minuutin pituiset ajat ovat psykoterapia-aikoja. 

Pidän myös yleislääkärin vastaanottoa. Olet tervetullut niin akuuttiasioissa kuin pitkäaikaissairauden hoitoa varten. 
En valitettavasti tee toimenpiteitä, ajoterveys-, aselupa tai raskaudenkeskeytyslausuntoja.","Kynnen poisto, Hengitystieinfektiot ja niiden hoito, Heikentynyt sokerinsieto, Pitkittyneen yskän tutkiminen ja hoito, e21c10b6-6094-4497-ae51-168a9221793e, Rähmivän silmän hoito, Keuhkoahtaumataudin hoito, Lasten infektiot ja tartuntataudit, Influenssa, Psykoterapia, psykoterapeutti, 10708229-ceb5-43cf-afc7-5b98875a477b, Silmän allergian  hoito, Työterveys- ja yleislääkäri sekä lääketieteen kandidaatti, Flunssa ja sen hoito, Rintakipu, Soittopyyntö, Punaisen silmän hoito, Migreenin hoito, Ihohaavan ompelu, Ummetus, Päänsäryn hoito, Työterveyden lyhytpsykoterapia, Ratkaisu- ja voimavarakeskeinen psykoterapia , Lihaskramppi, Hengenahdistus ja sen hoito, b8503a2f-f72b-4f6f-a22b-ce3cd591b9a0, Infektiosairauksien tutkimus ja hoito, Korkea kolesteroli, Huimaus ja sen hoito, Vuotavat silmät, Väsymys ja sen hoito, Pitkittynyt kuume, Silmätulehdus, Lapsen ja vauvan kuume, Astmatutkimukset ja astman hoito, Verenpainetauti, Korvatulehduksen hoito"
"3fd62988-eb2a-4263-8041-4216c59a82a4","Olli","Niemi","Psykoterapeutti","Psyykkistä hyvinvointia yksilöille, pareille ja perheille luottamuksellisessa yhteistyösuhteessa","Olen koulutukseltani erikoissairaanhoitaja ja yli 30 vuotta kestäneen työurani varrelta mukaani ovat tarttuneet perhe- ja paripsykoterapian erityispätevyydet sekä EDMR-terapiapätevyys. Työkokemukseni on kertynyt psykiatrian parista ja tärkeimmiksi itselleni ovat nousseet erilaiset terapeuttiset lähestymistavat ihmisten kohtaamisessa. Pyrin oman koulutukseni sekä työ- ja elämänkokemukseni kautta ymmärtämään tilannetta yhdessä asiakkaan kanssa, jotta turvallisessa ja luottamuksellisessa yhteistyösuhteessa voitaisiin löytää erilaisia ratkaisuja päästä eteenpäin. Vastaanotolleni voit tulla yksin, kumppanisi tai perheesi kanssa. Tarjoan seuraavia Kelan kuntoutuspsykoterapioita: perheterapia, paripsykoterapia ja vanhemman/vanhempien ohjauskäynnit (lapsen/nuorison oman psykoterapian tukena).","Surevan tuki, Elintapamuutosten psykologinen tuki, Stressin säätelytaitojen vahvistaminen, Pariterapia, Masennuksen tutkimus ja hoito , Sopeutumishäiriöiden tutkimus ja hoito, Psykoterapia, psykoterapeutti, Vanhempien ohjauskäynnit (osana lapsen tai nuoren psykoterapiaa) , Vakavaan sairauteen sopeutuminen, Työnohjauspalvelut, Kelan kuntoutuspsykoterapia, Eroauttaminen, Kognitiiviset menetelmät, Perheen tuki, Koulutuspsykoterapia, Soittopyyntö, EMDR, Ikääntyvän psykologinen tuki, Työuupumuksen tutkimus ja hoito, Työterveyden lyhytpsykoterapia, Fobioiden tutkimus ja hoito , Ahdistuneisuushäiriöiden tutkimus ja hoito , Kriisituki, Epävakaan persoonallisuushäiriön tutkimus ja hoito "
"7162c070-7ff2-443d-bfb6-6ceb7d409050","Mika","Viinikainen","Työterveyspsykologi, Psykoterapeutti","Työhyvinvointiin erikoistunut työterveyspsykologi, psykoterapeutti ja työnohjaaja","Toimin työterveyspsykologina, psykoterapeuttina, kouluttajana ja työnohjaajana ja minut on hyväksytty Tieteellinen Hypnoosi ry:n ja Suomen Työnohjaajat ry:n jäseneksi. Olen työskennellyt sekä julkisella että yksityisellä puolella yli kolmenkymmenen vuoden ajan lapsista vanhuksiin, kouluttamisesta psykiatriaan. Erityinen kiinnostukseni on ollut stressinhallinta-, ongelmanratkaisu- ja vuorovaikutustaitojen tukeminen.","Surevan tuki, Elintapamuutosten psykologinen tuki, Stressin säätelytaitojen vahvistaminen, Paniikkihäiriön tutkimus ja hoito , Pariterapia, Maahanmuuttajan ja turvapaikanhakijan tuki, Psykologi, Nuorten psykoterapia, Masennuksen tutkimus ja hoito , Sopeutumishäiriöiden tutkimus ja hoito, Väsymys, Psykoterapia, psykoterapeutti, Vakavaan sairauteen sopeutuminen, Kivun psykologinen hoito, afa8545f-02d2-4d39-9e1f-62fedbdb9724, Työnohjauspalvelut, ADHD:n arviointi ja tuki, Eroauttaminen, Kognitiiviset menetelmät, Perheen tuki, Soittopyyntö, Kaksisuuntaisen mielialahäiriön tutkimus ja hoito, Nuoren psykologinen tuki, Ikääntyvän psykologinen tuki, Unettomuus, Työuupumuksen tutkimus ja hoito, Mielen hyvinvoinnin asiantuntijaluennot, Tietoisuustaidot eli Mindfulness, Muistitesti, Työterveyden lyhytpsykoterapia, Parisuhteen tuki, Mielenterveyden tuki ja hoito, Fobioiden tutkimus ja hoito , Itsetuhoisuuden tutkimus ja hoito, Ahdistuneisuushäiriöiden tutkimus ja hoito , Hypnoterapia, Vihan käsittely, Psykologinen tutkimus, Pakko-oireiden tutkimus ja hoito, Kriisituki, Unettomuuden hoito (yksilötuki), Väsymys ja sen hoito, Perheterapia, Epävakaan persoonallisuushäiriön tutkimus ja hoito "
"9acf04da-8911-4328-ba72-6f0e89d6a69f","Minna","Vuorinen","Psykoterapeutti (KELA pätevyys), psykiatrinen sairaanhoitaja,","Syömishäiriöiden, masennuksen ja ahdistuksen hoitamiseen erikoistunut psykoterapeutti pitkällä ja monipuolisella kokemuksella","Olen yksilöpsykoterapeutti, psykofyysisiin terapiamenetelmiin ja parisuhteen hoitamiseen erikoistunut psykiatrinen sairaanhoitaja. Tarjoan sekä lyhyttä että pitkää psykoterapiaa, lyhyitä konsultaatioita sekä apua elämän kriiseihin. Työotteeni on aktiivinen, avoin ja helposti lähestyttävä. Minulle on tärkeää, että asiakas kokee tulevansa kuulluksi ja vakavasti otetuksi. Vahvuuteni on tunnesyömisen ja syömishäiriöiden hoidossa. Minulla on pitkäaikaista kokemusta myös mm. masennuksen, ahdistuksen ja pakko-oireiden hoitamisesta. Olen Valviran hyväksymä psykoterapeutti ja Kelan palveluntuottaja.","Psykoterapia, psykoterapeutti, Työterveyden lyhytpsykoterapia, 88f839d1-9603-4011-921e-be3cde638034"
"ca8e2f71-194a-4fe7-9c24-9716be57eab4","Tommi","Hautaniemi","Psykoterapeutti","Kriisi- ja traumaterapiaan erikoistunut psykoterapeutti","Olen psykologi ja ylemmän erityistason kognitiivinen psykoterapeutti sekä erityistason kriisi- ja traumapsykoterapeutti (sisältäen EMDR-terapian). Terapiasuhteen näen yhteistyönä, johon voi sisältyä myös kotitehtäviä. 

Haasteenasi voivat olla esimerkiksi ahdistuneisuushäiriöt, masennus ja vaikeat elämäntilanteet. Asiakkaani ovat aikuisia, jotka voivat olla myös Kelan hyväksymiä (max. 20 käyntikertaa). 

Minulla on yli 30 vuoden kokemus ja koulutus työyhteisöjen kehittämistyöstä ja työnohjauksesta. Palveluihini kuuluvat myös defusing (työyhteisön kriittisten tilanteiden purku) sekä henkinen ensiapu. Luennoin työelämän eri teemoista sekä kriisien ja traumojen käsittelystä. 

Tällä hetkellä en ota uusia asiakkaita.","Surevan tuki, Elintapamuutosten psykologinen tuki, Stressin säätelytaitojen vahvistaminen, Paniikkihäiriön tutkimus ja hoito , Psykologi, Masennuksen tutkimus ja hoito , Psykoterapia, psykoterapeutti, Vakavaan sairauteen sopeutuminen, afa8545f-02d2-4d39-9e1f-62fedbdb9724, Työnohjauspalvelut, Kelan kuntoutuspsykoterapia, Kognitiiviset menetelmät, Soittopyyntö, Kaksisuuntaisen mielialahäiriön tutkimus ja hoito, Ikääntyvän psykologinen tuki, Työuupumuksen tutkimus ja hoito, Mielen hyvinvoinnin asiantuntijaluennot, Tietoisuustaidot eli Mindfulness, Kognitiivinen psykoterapia, Työterveyden lyhytpsykoterapia, Mielenterveyden tuki ja hoito, Fobioiden tutkimus ja hoito , Itsetuhoisuuden tutkimus ja hoito, Ratkaisu- ja voimavarakeskeinen psykoterapia , Ahdistuneisuushäiriöiden tutkimus ja hoito , Kognitiivinen käyttäytymisterapia (KKT, CBT), Pakko-oireiden tutkimus ja hoito, Kriisituki, Riippuvuuksien arviointi ja tuki"
"cf5da611-7707-4de4-9097-2ab96b313984","Miia","Kokkola","Psykoterapeutti","Psykoterapeutti monipuolisella mielenterveyden asioihin liittyvällä kokemuksella","Työskentelen ratkaisukeskeisen psykoterapian viitekehyksessä, ja olen valmistunut psykoterapeutiksi vuonna 2011. Lisäkoulutuksena minulla on ratkaisukeskeisen neuropsykiatrisen valmentajan koulutus, sekä dialektisen käyttäytymisterapian perusteet. Työotteeltani olen utelias, eri näkökulmia pohtiva, rauhallinen kuuntelija. Omaan kokemusta monipuolisesti mielenterveyteen liittyvistä asioista; taustakoulutukseltani olen psykiatrinen sairaanhoitaja ja olen työskennellyt pääosan työurastani avohoidossa. Psykoterapiatyössä sovin tavoitteista aina tapauskohtaisesti asiakkaan kanssa. Minulle voi varata ajan yksittäisille konsultaatiokäynneille tai työterveyshuollon lyhytpsykoterapiaan. Teen myös Kelan kuntoutuspsykoterapioita, paikkatilanteen kysely ensin sähköpostiin (etunimi.sukunimi@terveystalo.com).","Stressin säätelytaitojen vahvistaminen, Neuropsykiatrinen valmennus, Paniikkihäiriön tutkimus ja hoito , Masennuksen tutkimus ja hoito , Sopeutumishäiriöiden tutkimus ja hoito, Psykoterapia, psykoterapeutti, Vakavaan sairauteen sopeutuminen, Työuupumuksen tutkimus ja hoito, Työterveyden lyhytpsykoterapia, Mielenterveyden tuki ja hoito, Ratkaisu- ja voimavarakeskeinen psykoterapia , Ahdistuneisuushäiriöiden tutkimus ja hoito , Pakko-oireiden tutkimus ja hoito"
